{
  "schemaVersion": 1,
  "format": "hybridclr.dhe-runtime-release.json",
  "engineWorkflow": "Unity2022Fgs",
  "packageUpstream": "8.13.0",
  "runtimeContract": "dhe-runtime-v34",
  "nativeSourceCanonicalSha256": "21A8D9B6707FADFDD3802238AE587DDC86059C507B65CD2A4632D8FD275F1243",
  "nativeSourceFileCount": 927,
  "repositories": {
    "hybridclr": {
      "tag": "a4807e563c0cb245519a44c6ea7cc633246dd337",
      "commit": "a4807e563c0cb245519a44c6ea7cc633246dd337"
    },
    "il2cpp_plus": {
      "tag": "a1ec0324a8a58cb8e175c7b86665d70b5afae57e",
      "commit": "a1ec0324a8a58cb8e175c7b86665d70b5afae57e"
    }
  }
}
