{
  "schemaVersion": 1,
  "format": "hybridclr.dhe-runtime-release.json",
  "engineWorkflow": "Unity2022Fgs",
  "packageUpstream": "8.13.0",
  "runtimeContract": "dhe-runtime-v34",
  "nativeSourceCanonicalSha256": "C47C1B2DC0B812791E2ECC2795816CF3984047B7F9DF6C39841FFA5C5D77039F",
  "nativeSourceFileCount": 927,
  "repositories": {
    "hybridclr": {
      "tag": "236128de84c29958ce5f9aa3a404d416bb229f3c",
      "commit": "236128de84c29958ce5f9aa3a404d416bb229f3c"
    },
    "il2cpp_plus": {
      "tag": "v2022-8.11.0-opt6",
      "commit": "57f3a065e84e3b1e7e13c1012752e27f23e4c041"
    }
  }
}
